University,U.S. News Rankings,College,Majors in that college,College Specific Acceptance Rate,Description for Majors
MIT,2,School of Architecture and Planning,Architecture (Course 4),"4.6% for the entire university — MIT does not publish school-specific acceptance rates, and the major listed on the application does not alter one's chances of getting accepted.","Studies the design, theory, and history of buildings and spatial environments, blending studio design with structural, environmental, and computational methods to shape the built world."
,,,Art and Design (Course 4-B),,"Integrates studio art practice with design thinking, digital fabrication, and visual culture critique to produce contemporary creative work at the intersection of art and technology."
,,,"Art, Culture and Technology (Course 4)",,"Examines how artistic practice intersects with emerging technologies and social systems, producing experimental media, installation, and critical cultural work."
,,,Urban Studies and Planning (Course 11),,"Combines social science, design, policy analysis, and quantitative methods to study cities, housing, transportation, and the politics of urban and regional development."
,,,"Urban Science and Planning with Computer Science (Course 11-6, joint with EECS)",,"Applies data science, geographic information systems (GIS), and software engineering to optimize urban design, transportation networks, and evidence-based public policy."
MIT,,School of Engineering,Civil Engineering (Course 1-C),"4.6% for the entire university — MIT does not publish school-specific acceptance rates, and the major listed on the application does not alter one's chances of getting accepted.","Focuses on the design, construction, and management of human-made infrastructure, complex structural systems, and sustainable urban frameworks."
,,,Environmental Engineering Science (Course 1-E),,"Combines chemical, physical, and biological sciences to remediate pollution, manage vital water resources, and engineer ecological preservation solutions."
,,,"Climate System Science and Engineering (Course 1-12, offered jointly with Earth, Atmospheric, and Planetary Sciences)",,"Jointly offered with Earth Sciences to teach data analytics, computational modeling, and core engineering principles necessary for climate mitigation and adaptation."
,,,Mechanical Engineering (Course 2),,"Covers the core mechanics, thermodynamics, fluid dynamics, and materials science needed to design thermal systems, robotics, and advanced manufacturing technologies."
,,,Mechanical and Ocean Engineering (Course 2-OE),,"Integrates standard mechanical design with marine physics to build advanced oceanographic systems, submersibles, and autonomous underwater vehicles."
,,,"Engineering as Recommended by the Department of Mechanical Engineering (Course 2-A, a flexible, customizable track)",,"Allows students to combine core mechanical engineering fundamentals with tailored concentrations in fields like biomechanics, product design, or management."
,,,Materials Science and Engineering (Course 3),,"Studies how atomic structure, processing methods, and thermodynamic properties dictate the performance of metals, polymers, semiconductors, and biomaterials."
,,,"Archaeology and Materials (Course 3-C, offered jointly with the Department of Anthropology)",,A specialized joint track with Anthropology using advanced material science testing — such as forensics and spectroscopy — to analyze archaeological artifacts and ancient technologies.
,,,Electrical Engineering and Computer Science (Course 6-2),,"Explores the sweet spot where hardware meets software, detailing physical circuit building alongside firmware development and computer architecture."
,,,Computer Science and Engineering (Course 6-3),,"Delves deeply into algorithmic systems, complex software engineering, cloud computing, cryptography, and theoretical computational boundaries."
,,,Artificial Intelligence and Decision Making (Course 6-4),,"Analyzes the mathematical and practical frameworks behind machine learning models, autonomous systems, statistics, and neural networks."
,,,Electrical Engineering with Computing (Course 6-5),,"Connects physical devices, quantum systems, signal processing, and electromagnetics with foundational computing logic."
,,,"Computer Science and Molecular Biology (Course 6-7, joint with Biology)",,"Bridges heavy software engineering with biological data, preparing graduates to manage bioinformatics platforms and genomic sequencing technologies."
,,,"Computation and Cognition (Course 6-9, joint with Brain & Cognitive Sciences)",,"Connects cognitive brain sciences with computer modeling to study artificial intelligence, human perception, and machine learning architectures."
,,,"Computer Science, Economics, and Data Science (Course 6-14, joint with Economics)",,"Blends data analytics and system modeling with mathematical economic theory, game theory, and market design."
,,,"Urban Science and Planning with Computer Science (Course 11-6, joint with Urban Studies)",,"Applies data science, geographic information systems (GIS), and software tools to optimize urban design, transportation networks, and public policy."
,,,Chemical Engineering (Course 10),,"Focuses on scaling chemical processes from the laboratory bench to industrial-scale manufacturing of fuels, electronics, and materials."
,,,Chemical-Biological Engineering (Course 10-B),,"Combines molecular biology and biochemistry with chemical kinetics to engineer pharmaceuticals, bioplastics, and metabolic technologies."
,,,"Engineering as Recommended by the Department of Chemical Engineering (Course 10-C, flexible track)",,"Adapts chemical engineering principles toward customized student tracks in clean energy, business management, or global policy."
,,,Aerospace Engineering (Course 16),,"Analyzes aerodynamics, vehicle structures, autonomous guidance, propulsion systems, and orbital mechanics for atmospheric and space flight vehicles."
,,,"Engineering as Recommended by the Department of Aeronautics and Astronautics (Course 16-ENG, flexible track)",,"Provides basic aerospace grounding while embedding an interdisciplinary focus track, such as flight software, robotics, or computational modeling."
,,,Biological Engineering (Course 20),,"Applies quantitative engineering methodologies to manipulate biological mechanisms, design synthetic cells, and construct novel biomolecules or tissue scaffolds."
,,,Nuclear Science and Engineering (Course 22),,"Investigates the applications of low-energy nuclear physics, spanning carbon-free fusion/fission energy systems, medical imaging, radiation safety, and quantum engineering."
,,,"Humanities and Engineering (Course 21E, allows students to combine a baseline engineering track with a humanities concentration)",,Blends a full concentration in a chosen humanities discipline (like History or Literature) with a fundamental core curriculum in an engineering track.
,,"School of Humanities, Arts, and Social Sciences (SHASS)",Anthropology (Course 21A),"4.6% for the entire university — MIT does not publish school-specific acceptance rates, and the major listed on the application does not alter one's chances of getting accepted.","Studies human societies, cultures, and behavior through ethnographic fieldwork and cross-cultural analysis, with strengths in science, technology, and medical anthropology."
,,,Comparative Media Studies (CMS),,"Analyzes media forms — film, games, journalism, social platforms — across history and culture, combining critical theory with hands-on media production."
,,,Economics (Course 14-1),,"Applies rigorous mathematical and statistical modeling to study markets, labor, growth, public policy, and behavioral decision-making at micro and macro scales."
,,,Mathematical Economics (Course 14-2),,"An intensive track combining advanced mathematics, econometrics, and economic theory for students pursuing graduate work or quantitative research."
,,,"Global Studies and Languages (Course 21G — Chinese, French, German, Japanese, Russian, Spanish, etc.)",,"Develops advanced proficiency in a world language alongside study of the literature, history, politics, and culture of the associated regions."
,,,History (Course 21H),,"Investigates political, social, scientific, and cultural change across regions and eras using primary sources, archival research, and historiographical methods."
,,,Linguistics and Philosophy (Course 24-2),,"Combines formal study of language structure — phonology, syntax, semantics — with philosophical questions about meaning, mind, and knowledge."
,,,Literature (Course 21L),,"Engages closely with poetry, fiction, drama, and film across periods and traditions, building skills in critical reading, interpretation, and analytical writing."
,,,Music (Course 21M-1),,"Trains students in music theory, history, composition, and performance, with access to MIT's ensembles, electronic music studios, and music technology labs."
,,,Theater Arts (Course 21M-2),,"Combines acting, directing, design, and dramatic literature with hands-on production work in MIT's theater spaces and collaborations with professional artists."
,,,Philosophy (Course 24-1),,"Examines foundational questions in ethics, metaphysics, epistemology, logic, and political theory, with strong analytic and formal-logic traditions at MIT."
,,,Political Science (Course 17),,"Applies empirical methods and political theory to study elections, institutions, international relations, security, and the politics of technology and policy."
,,,"Science, Technology, and Society (STS)",,"Examines how scientific knowledge and technological systems are produced, contested, and shaped by social, historical, ethical, and political forces."
,,,Writing (Course 21W),,"Develops craft across creative nonfiction, fiction, poetry, journalism, science writing, and digital media through intensive workshop-style instruction."
,,,Humanities (Course 21),,"A flexible major allowing students to design a concentration drawing from two or more humanities disciplines such as history, literature, and philosophy."
,,,Humanities and Science (Course 21S),,"Pairs a full humanities concentration with a complete science major, training students fluent in both interpretive and quantitative modes of inquiry."
,,,Humanities and Engineering (Course 21E),,"Pairs a full humanities concentration with a complete engineering track, preparing graduates who can bridge technical work with cultural and ethical reasoning."
,,MIT Sloan School of Management,Management (Course 15-1),"4.6% for the entire university — MIT does not publish school-specific acceptance rates, and the major listed on the application does not alter one's chances of getting accepted.","Builds core business fundamentals — strategy, organizations, operations, marketing, and accounting — emphasizing analytical decision-making and entrepreneurial leadership."
,,,Business Analytics (Course 15-2),,"Applies statistics, optimization, and machine learning to operational and strategic business problems, training students to extract insight from large enterprise datasets."
,,,Finance (Course 15-3),,"Covers asset pricing, corporate finance, derivatives, and financial engineering, combining economic theory with the quantitative methods used in modern financial markets."
,,School of Science,Biology (Course 7),"4.6% for the entire university — MIT does not publish school-specific acceptance rates, and the major listed on the application does not alter one's chances of getting accepted.","Studies the molecular, cellular, and organismal foundations of life, with deep training in genetics, biochemistry, microbiology, and modern experimental methods."
,,,Chemistry (Course 5),,"Covers organic, inorganic, physical, and analytical chemistry, with extensive laboratory training in synthesis, spectroscopy, and the quantitative study of matter."
,,,"Chemistry and Biology (Course 5-7, joint with Biology)",,"An interdisciplinary track integrating chemical principles with molecular biology to prepare students for biochemistry, drug discovery, and chemical biology research."
,,,Brain and Cognitive Sciences (Course 9),,"Examines the mind and brain from molecules to cognition, combining neuroscience, psychology, computation, and systems-level study of perception and behavior."
,,,"Earth, Atmospheric, and Planetary Sciences (Course 12)",,"Investigates the physics, chemistry, and history of Earth and other planets, covering geology, oceanography, atmospheric science, and planetary exploration."
,,,Mathematics (Course 18),,"Provides rigorous training in pure and applied mathematics — analysis, algebra, topology, probability, and combinatorics — preparing students for research and quantitative careers."
,,,Mathematics with Computer Science (Course 18-C),,"Combines core mathematics with theoretical computer science, focusing on algorithms, discrete math, logic, and the mathematical foundations of computation."
,,,Physics (Course 8),,"Covers classical and quantum mechanics, electromagnetism, thermodynamics, relativity, and modern experimental physics with extensive laboratory and computational training."
,,,"Physics, Flexible Option (Course 8 Flexible)",,"A flexible physics track allowing concentration in adjacent fields such as biophysics, astrophysics, geophysics, or quantitative finance."
,,MIT Stephen A. Schwarzman College of Computing,Computer Science and Engineering (Course 6-3),"4.6% for the entire university — MIT does not publish school-specific acceptance rates, and the major listed on the application does not alter one's chances of getting accepted.","Provides deep training in algorithms, software engineering, systems, cloud and distributed computing, cryptography, and the theoretical foundations of computation."
,,,Electrical Engineering and Computer Science (Course 6-2),,"Bridges electrical hardware and software, combining circuit design, embedded systems, and computer architecture with programming and algorithmic foundations."
,,,Electrical Engineering with Computing (Course 6-5),,"Pairs physical devices, signal processing, electromagnetics, and quantum systems with the computing logic needed to design and control them."
,,,Artificial Intelligence and Decision Making (Course 6-4),,"Focuses on the mathematics and engineering of machine learning, statistics, autonomous systems, and decision-making under uncertainty."
,,,"Computer Science and Molecular Biology (Course 6-7, joint with Biology)",,"Combines algorithms, software engineering, and large-scale data analysis with molecular biology to power bioinformatics, genomics, and computational biology."
,,,"Computation and Cognition (Course 6-9, joint with Brain & Cognitive Sciences)",,"Connects cognitive science with computational modeling to study learning, perception, and the algorithmic basis of intelligence in brains and machines."
,,,"Computer Science, Economics, and Data Science (Course 6-14, joint with Economics)",,"Integrates data science and computation with economic theory, game theory, and market design for analytics, policy, and platform engineering."
,,,"Urban Science and Planning with Computer Science (Course 11-6, joint with Urban Studies and Planning)",,"Uses data science, GIS, and software tools to study and design transportation networks, housing, and equitable, evidence-based urban policy."